<!ELEMENT peliculas (pelicula*)>
  <!ELEMENT pelicula (((titulo, director) | (director, titulo)), autor)>
  <!ELEMENT autor (#PCDATA)>  
  <!ELEMENT titulo (#PCDATA)>
  <!ELEMENT director (#PCDATA)>