<?xml version="1.0" encoding="UTF-8"?>
<!DOCTYPE peliculas SYSTEM "Ejercicio31.dtd">
<peliculas>
  <pelicula>
    <titulo>Con faldas y a lo loco</titulo>
    <director>Billy Wilder</director>
    <autor>paco</autor>
  </pelicula>
  <pelicula>
    <director>Leo McCarey</director>
    <titulo>Sopa de ganso</titulo>
    <autor>barto</autor>
  </pelicula>
</peliculas>